{
  "schemaVersion": 1,
  "id": "validation-recovery",
  "decisionId": "D-020",
  "components": [
    "admin-form",
    "text-field",
    "textarea",
    "select",
    "checkbox",
    "alert",
    "button",
    "table"
  ],
  "stages": [
    "editing",
    "invalid",
    "review",
    "busy",
    "success"
  ],
  "transitions": [
    {
      "from": "editing",
      "event": "submit",
      "to": [
        "invalid",
        "review"
      ]
    },
    {
      "from": "invalid",
      "event": "submit",
      "to": [
        "invalid",
        "review"
      ]
    },
    {
      "from": "review",
      "event": "edit",
      "to": [
        "editing"
      ]
    },
    {
      "from": "review",
      "event": "confirm",
      "to": [
        "busy"
      ]
    },
    {
      "from": "busy",
      "event": "complete",
      "to": [
        "success"
      ]
    },
    {
      "from": "success",
      "event": "edit",
      "to": [
        "editing"
      ]
    }
  ],
  "fields": [
    {
      "id": "name",
      "type": "text",
      "label": "Name",
      "help": "Shown in the example record. The fixture reserves ws-07.",
      "required": true,
      "options": []
    },
    {
      "id": "hostname",
      "type": "text",
      "label": "Hostname",
      "help": "Lowercase letters, digits and hyphens. The fixture reserves ws-07.",
      "required": true,
      "options": []
    },
    {
      "id": "role",
      "type": "select",
      "label": "Role",
      "help": "An example role, with no account permissions attached.",
      "required": false,
      "options": [
        {
          "id": "dev",
          "label": "Development"
        },
        {
          "id": "build",
          "label": "Build agent"
        },
        {
          "id": "kiosk",
          "label": "Kiosk"
        }
      ]
    },
    {
      "id": "notes",
      "type": "textarea",
      "label": "Notes",
      "help": "Plain text retained only in this page.",
      "required": false,
      "options": []
    },
    {
      "id": "enabled",
      "type": "checkbox",
      "label": "Enable after saving",
      "help": "Demonstrates a boolean value; no real record is enabled.",
      "required": false,
      "options": []
    }
  ],
  "fixtures": {
    "invalid": {
      "name": "ws-07",
      "hostname": "ws-07",
      "role": "dev",
      "notes": "Keep these notes while correcting the two fields.",
      "enabled": true
    },
    "valid": {
      "name": "ws-08",
      "hostname": "ws-08",
      "role": "dev",
      "notes": "Keep these notes while correcting the two fields.",
      "enabled": true
    }
  },
  "validation": "Required values, supported choices, a bounded text length, and explicit local workstation fixture conflicts. Never server-side validation.",
  "announcements": "Errors update on submit, not on input. The summary receives focus; links focus the named field. Review, busy and success update the status once per transition.",
  "tests": [
    "tests/form-model.test.js",
    "tests/browser/validation-recovery.spec.js"
  ],
  "limits": [
    "Local simulation only; no request, account, database or persistence.",
    "Busy requires an explicit simulation-completion event; a submit click is not success.",
    "Automated keyboard/DOM/axe evidence does not claim a manual screen-reader or user-research pass."
  ],
  "version": "4.0.0",
  "theme": {
    "name": "j3w1-theme",
    "version": "4.0.0",
    "profile": "default",
    "sourceDigest": "sha256-9w2X6Cih03PDyOMVu4XmMrmPqHs2iwGGaq5TvafCIUw="
  },
  "componentDigests": {
    "admin-form": "sha256-2TlXwKoXO6zcy7Tx++Cm2rh/hlfQSzLAgg3iHIMc+A8=",
    "alert": "sha256-N1aX81ExUlcbLny7o1Ps8qNiXl6FYwt1lU+/g3RZXRk=",
    "button": "sha256-fpx3utLRj/ejAQlUy5k14oQwbTIClAI9Oi8Ogyd+d+A=",
    "checkbox": "sha256-eF4Hc9ptoJR6MAHCFo+XvObHeyrh3JBIEF3jPCA/Yqs=",
    "radio-group": "sha256-XKfMy84MCW/4OhLmJs9UpY5QmTfzmmfVWep27KMO9Us=",
    "select": "sha256-+104x89k42mQE/HXROEO3H3J0LiouM+rmSaBTau7/v4=",
    "table": "sha256-00qzkQ7+Z1S4KyMdpqY7rpJwF1ThX9GPyF2seTosYNM=",
    "text-field": "sha256-xaKWYj2Xr70t21J4K+RaHFYIJqrHERfUjkuGDynhXYI=",
    "textarea": "sha256-+ESs+Xw17KqNhLGqYUv+TY/epN/X8kJNtB80OUFgArw="
  }
}
